{"entries":[{"candidates":["docker.io/grafana/alloy@sha256:b8ec653c44235fbe910879145dac3597d66b0aaecf60bcbbe82580767771a839"],"cloudflareCandidates":["docker.lunafox.cc.cd/grafana/alloy@sha256:b8ec653c44235fbe910879145dac3597d66b0aaecf60bcbbe82580767771a839","docker.io/grafana/alloy@sha256:b8ec653c44235fbe910879145dac3597d66b0aaecf60bcbbe82580767771a839"],"digest":"sha256:b8ec653c44235fbe910879145dac3597d66b0aaecf60bcbbe82580767771a839","identityReference":"docker.io/grafana/alloy@sha256:b8ec653c44235fbe910879145dac3597d66b0aaecf60bcbbe82580767771a839","platforms":["linux/amd64","linux/arm64"],"profiles":["embedded","external"],"repository":"grafana/alloy","sources":[{"kind":"compose-service","name":"alloy"}],"trust":"third-party"},{"candidates":["docker.io/grafana/loki@sha256:3c8fd3570dd9219951a60d3f919c7f31923d10baee578b77bc26c4a0b32d092d"],"cloudflareCandidates":["docker.lunafox.cc.cd/grafana/loki@sha256:3c8fd3570dd9219951a60d3f919c7f31923d10baee578b77bc26c4a0b32d092d","docker.io/grafana/loki@sha256:3c8fd3570dd9219951a60d3f919c7f31923d10baee578b77bc26c4a0b32d092d"],"digest":"sha256:3c8fd3570dd9219951a60d3f919c7f31923d10baee578b77bc26c4a0b32d092d","identityReference":"docker.io/grafana/loki@sha256:3c8fd3570dd9219951a60d3f919c7f31923d10baee578b77bc26c4a0b32d092d","platforms":["linux/amd64","linux/arm64"],"profiles":["embedded","external"],"repository":"grafana/loki","sources":[{"kind":"compose-service","name":"loki"}],"trust":"third-party"},{"candidates":["docker.io/library/postgres@sha256:67f41722b7a8cbdb868a44a4995c846eddfdc2973bccb291ce937dce88ad5675"],"cloudflareCandidates":["docker.lunafox.cc.cd/library/postgres@sha256:67f41722b7a8cbdb868a44a4995c846eddfdc2973bccb291ce937dce88ad5675","docker.io/library/postgres@sha256:67f41722b7a8cbdb868a44a4995c846eddfdc2973bccb291ce937dce88ad5675"],"digest":"sha256:67f41722b7a8cbdb868a44a4995c846eddfdc2973bccb291ce937dce88ad5675","identityReference":"docker.io/library/postgres@sha256:67f41722b7a8cbdb868a44a4995c846eddfdc2973bccb291ce937dce88ad5675","platforms":["linux/amd64","linux/arm64"],"profiles":["embedded"],"repository":"library/postgres","sources":[{"kind":"compose-service","name":"postgres"}],"trust":"third-party"},{"candidates":["docker.io/library/redis@sha256:2afba59292f25f5d1af200496db41bea2c6c816b059f57ae74703a50a03a27d0"],"cloudflareCandidates":["docker.lunafox.cc.cd/library/redis@sha256:2afba59292f25f5d1af200496db41bea2c6c816b059f57ae74703a50a03a27d0","docker.io/library/redis@sha256:2afba59292f25f5d1af200496db41bea2c6c816b059f57ae74703a50a03a27d0"],"digest":"sha256:2afba59292f25f5d1af200496db41bea2c6c816b059f57ae74703a50a03a27d0","identityReference":"docker.io/library/redis@sha256:2afba59292f25f5d1af200496db41bea2c6c816b059f57ae74703a50a03a27d0","platforms":["linux/amd64","linux/arm64"],"profiles":["embedded","external"],"repository":"library/redis","sources":[{"kind":"compose-service","name":"redis"}],"trust":"third-party"},{"candidates":["docker.io/yyhuni/lunafox-agent@sha256:7cc372dac0dde52dc68c9e9dd4d6a817231a2a93b83a8b573774c73ee33f21d7","ghcr.io/yyhuni/lunafox-agent@sha256:7cc372dac0dde52dc68c9e9dd4d6a817231a2a93b83a8b573774c73ee33f21d7"],"cloudflareCandidates":["docker.lunafox.cc.cd/yyhuni/lunafox-agent@sha256:7cc372dac0dde52dc68c9e9dd4d6a817231a2a93b83a8b573774c73ee33f21d7","docker.io/yyhuni/lunafox-agent@sha256:7cc372dac0dde52dc68c9e9dd4d6a817231a2a93b83a8b573774c73ee33f21d7","ghcr.io/yyhuni/lunafox-agent@sha256:7cc372dac0dde52dc68c9e9dd4d6a817231a2a93b83a8b573774c73ee33f21d7"],"digest":"sha256:7cc372dac0dde52dc68c9e9dd4d6a817231a2a93b83a8b573774c73ee33f21d7","identityReference":"ghcr.io/yyhuni/lunafox-agent@sha256:7cc372dac0dde52dc68c9e9dd4d6a817231a2a93b83a8b573774c73ee33f21d7","platforms":["linux/amd64","linux/arm64"],"profiles":["embedded","external"],"repository":"yyhuni/lunafox-agent","sources":[{"kind":"compose-service","name":"agent"},{"kind":"compose-service","name":"agent-preflight"},{"kind":"compose-service","name":"engine-preheater"}],"trust":"first-party"},{"candidates":["docker.io/yyhuni/lunafox-bootstrap@sha256:b46d21786fb32b1c86ab40689ebc15293e1701a88b8dbd65ed572e2069f3ee1d","ghcr.io/yyhuni/lunafox-bootstrap@sha256:b46d21786fb32b1c86ab40689ebc15293e1701a88b8dbd65ed572e2069f3ee1d"],"cloudflareCandidates":["docker.lunafox.cc.cd/yyhuni/lunafox-bootstrap@sha256:b46d21786fb32b1c86ab40689ebc15293e1701a88b8dbd65ed572e2069f3ee1d","docker.io/yyhuni/lunafox-bootstrap@sha256:b46d21786fb32b1c86ab40689ebc15293e1701a88b8dbd65ed572e2069f3ee1d","ghcr.io/yyhuni/lunafox-bootstrap@sha256:b46d21786fb32b1c86ab40689ebc15293e1701a88b8dbd65ed572e2069f3ee1d"],"digest":"sha256:b46d21786fb32b1c86ab40689ebc15293e1701a88b8dbd65ed572e2069f3ee1d","identityReference":"ghcr.io/yyhuni/lunafox-bootstrap@sha256:b46d21786fb32b1c86ab40689ebc15293e1701a88b8dbd65ed572e2069f3ee1d","platforms":["linux/amd64","linux/arm64"],"profiles":["embedded","external"],"repository":"yyhuni/lunafox-bootstrap","sources":[{"kind":"compose-service","name":"bootstrap"},{"kind":"compose-service","name":"cert-init"},{"kind":"compose-service","name":"config-init"},{"kind":"compose-service","name":"migrate"},{"kind":"compose-service","name":"upgrader"}],"trust":"first-party"},{"candidates":["docker.io/yyhuni/lunafox-engine-runtime-directory-scan@sha256:d3676354077198c0a44726450ef12446b6aae56129403b55128625da888fa86f","ghcr.io/yyhuni/lunafox-engine-runtime-directory-scan@sha256:d3676354077198c0a44726450ef12446b6aae56129403b55128625da888fa86f"],"cloudflareCandidates":["docker.lunafox.cc.cd/yyhuni/lunafox-engine-runtime-directory-scan@sha256:d3676354077198c0a44726450ef12446b6aae56129403b55128625da888fa86f","docker.io/yyhuni/lunafox-engine-runtime-directory-scan@sha256:d3676354077198c0a44726450ef12446b6aae56129403b55128625da888fa86f","ghcr.io/yyhuni/lunafox-engine-runtime-directory-scan@sha256:d3676354077198c0a44726450ef12446b6aae56129403b55128625da888fa86f"],"digest":"sha256:d3676354077198c0a44726450ef12446b6aae56129403b55128625da888fa86f","identityReference":"ghcr.io/yyhuni/lunafox-engine-runtime-directory-scan@sha256:d3676354077198c0a44726450ef12446b6aae56129403b55128625da888fa86f","platforms":["linux/amd64","linux/arm64"],"profiles":["embedded","external"],"repository":"yyhuni/lunafox-engine-runtime-directory-scan","sources":[{"kind":"engine-runtime","name":"lunafox.directory_scan"}],"trust":"first-party"},{"candidates":["docker.io/yyhuni/lunafox-engine-runtime-fingerprint-detection@sha256:070cb373c66093cb5725adb15635809743eb6fe0bdc47323f783e2b490a39247","ghcr.io/yyhuni/lunafox-engine-runtime-fingerprint-detection@sha256:070cb373c66093cb5725adb15635809743eb6fe0bdc47323f783e2b490a39247"],"cloudflareCandidates":["docker.lunafox.cc.cd/yyhuni/lunafox-engine-runtime-fingerprint-detection@sha256:070cb373c66093cb5725adb15635809743eb6fe0bdc47323f783e2b490a39247","docker.io/yyhuni/lunafox-engine-runtime-fingerprint-detection@sha256:070cb373c66093cb5725adb15635809743eb6fe0bdc47323f783e2b490a39247","ghcr.io/yyhuni/lunafox-engine-runtime-fingerprint-detection@sha256:070cb373c66093cb5725adb15635809743eb6fe0bdc47323f783e2b490a39247"],"digest":"sha256:070cb373c66093cb5725adb15635809743eb6fe0bdc47323f783e2b490a39247","identityReference":"ghcr.io/yyhuni/lunafox-engine-runtime-fingerprint-detection@sha256:070cb373c66093cb5725adb15635809743eb6fe0bdc47323f783e2b490a39247","platforms":["linux/amd64","linux/arm64"],"profiles":["embedded","external"],"repository":"yyhuni/lunafox-engine-runtime-fingerprint-detection","sources":[{"kind":"engine-runtime","name":"lunafox.fingerprint_detection"}],"trust":"first-party"},{"candidates":["docker.io/yyhuni/lunafox-engine-runtime-nuclei-vulnerability@sha256:b8d127885d7b888e58717de465debdd3916dcbfd05ea6eabe396d1b1bf0ef7ea","ghcr.io/yyhuni/lunafox-engine-runtime-nuclei-vulnerability@sha256:b8d127885d7b888e58717de465debdd3916dcbfd05ea6eabe396d1b1bf0ef7ea"],"cloudflareCandidates":["docker.lunafox.cc.cd/yyhuni/lunafox-engine-runtime-nuclei-vulnerability@sha256:b8d127885d7b888e58717de465debdd3916dcbfd05ea6eabe396d1b1bf0ef7ea","docker.io/yyhuni/lunafox-engine-runtime-nuclei-vulnerability@sha256:b8d127885d7b888e58717de465debdd3916dcbfd05ea6eabe396d1b1bf0ef7ea","ghcr.io/yyhuni/lunafox-engine-runtime-nuclei-vulnerability@sha256:b8d127885d7b888e58717de465debdd3916dcbfd05ea6eabe396d1b1bf0ef7ea"],"digest":"sha256:b8d127885d7b888e58717de465debdd3916dcbfd05ea6eabe396d1b1bf0ef7ea","identityReference":"ghcr.io/yyhuni/lunafox-engine-runtime-nuclei-vulnerability@sha256:b8d127885d7b888e58717de465debdd3916dcbfd05ea6eabe396d1b1bf0ef7ea","platforms":["linux/amd64","linux/arm64"],"profiles":["embedded","external"],"repository":"yyhuni/lunafox-engine-runtime-nuclei-vulnerability","sources":[{"kind":"engine-runtime","name":"lunafox.nuclei_vulnerability"}],"trust":"first-party"},{"candidates":["docker.io/yyhuni/lunafox-engine-runtime-port-scan@sha256:ef778b4a80ace83491608d88730442c7d9ab004779a8795d0fef2a57e5fd9d3e","ghcr.io/yyhuni/lunafox-engine-runtime-port-scan@sha256:ef778b4a80ace83491608d88730442c7d9ab004779a8795d0fef2a57e5fd9d3e"],"cloudflareCandidates":["docker.lunafox.cc.cd/yyhuni/lunafox-engine-runtime-port-scan@sha256:ef778b4a80ace83491608d88730442c7d9ab004779a8795d0fef2a57e5fd9d3e","docker.io/yyhuni/lunafox-engine-runtime-port-scan@sha256:ef778b4a80ace83491608d88730442c7d9ab004779a8795d0fef2a57e5fd9d3e","ghcr.io/yyhuni/lunafox-engine-runtime-port-scan@sha256:ef778b4a80ace83491608d88730442c7d9ab004779a8795d0fef2a57e5fd9d3e"],"digest":"sha256:ef778b4a80ace83491608d88730442c7d9ab004779a8795d0fef2a57e5fd9d3e","identityReference":"ghcr.io/yyhuni/lunafox-engine-runtime-port-scan@sha256:ef778b4a80ace83491608d88730442c7d9ab004779a8795d0fef2a57e5fd9d3e","platforms":["linux/amd64","linux/arm64"],"profiles":["embedded","external"],"repository":"yyhuni/lunafox-engine-runtime-port-scan","sources":[{"kind":"engine-runtime","name":"lunafox.port_scan"}],"trust":"first-party"},{"candidates":["docker.io/yyhuni/lunafox-engine-runtime-screenshot@sha256:163a79f72313d537785c11c8605d9a35bb6a4ea9aae55ed25af1c38855e